Sheet: Sheet1
A1: Parts List | B1: Price | C1: Quantity | D1: Total | E1: Link
A3: Locomotion and Mobility
A4: Motors and Motor Drive Circuits | E4: From Mr. Kennedy
A5: Wheel Encoders | E5: I think this has to do with the H-Bridge we were talking about in the meeting today, see locomotion
A7: Obstacle Avoidance
A8: IR Proximity Sensors | B8: 14.95 | C8: 2 | D8: =RC[-2]*RC[-1] -> 29.9 | E8: http://www.sparkfun.com/commerce/product_info.php?products_id=8958 | F8: http://www.sparkfun.com/commerce/product_info.php?products_id=8733
A9: Ultra Sonic Ranging | E9: From Mr Kennedy?
A10: Flex Sensors | B10: 12.95 | C10: 2 | D10: =RC[-2]*RC[-1] -> 25.9 | E10: http://www.sparkfun.com/commerce/product_info.php?products_id=8606
A12: Navigation Systems
A13: GPS Receiver | B13: 59.95 | C13: 1 | D13: =RC[-2]*RC[-1] -> 59.95 | E13: http://www.sparkfun.com/commerce/product_info.php?products_id=8975
A14: Electronic Compass | B14: 34.95 | C14: 1 | D14: =RC[-2]*RC[-1] -> 34.95 | E14: http://www.sparkfun.com/commerce/product_info.php?products_id=7915 | F14: (Does this actually come with the compass, or is it just the module?)
A15: Beacon Triangulation | E15: Some parts from Mr. Kennedy? Also a microcontroller will be needed
A17: Microcontrollers
A18: PIC18F's should do | E18: We can get samples of them at the microchip website
E19: These will interface with the Beagleboard somehow via i2c. The beagleboard will send/receive commands to the pics and figure out what to do with them
A22: Central Control
A23: Beagle Board | B23: 149.95 | C23: 1 | D23: =RC[-2]*RC[-1] -> 149.95 | E23: http://search.digikey.com/scripts/DkSearch/dksus.dll?lang=en&site=US&KeyWords=296-23428-ND
A24: HDMI Female to DVI male(Not sure if we really need this) | B24: 3.5 | C24: 1 | D24: =RC[-2]*RC[-1] -> 3.5 | E24: http://www.amazon.com/RiteAV-HDMI-Female-Male-Adapter/dp/B000V1O1JO
A25: USB hub | B25: 24 | C25: 1 | D25: =RC[-2]*RC[-1] -> 24 | E25: http://www.amazon.com/D-Link-DUB-H4-High-Speed-4-Port/dp/B00006B7DA/ref=dp_cp_ob_e_title_0
A26: SD card | D26: =RC[-2]*RC[-1] -> 0 | E26: Have an extra
A27: Cable | E27: Have an extra
A31: *NOTE*
A32: I think for the ultrasonic sensorsâ€¦ we need to mount one on a servo.
C36: TOTAL: | D36: =SUM(R[-34]C:R[-4]C) -> 328.15
C38: FUNDS LEFT: | D38: =750-R[-2]C -> 421.85